USER,DATE,STAR,LIKE,TITLE,REVIEW
리로드09,2023-09-17 05:46:08-07:00,1,0,아래다른분 후기처럼 업데이트했더니,파란화면만 뜨고 넘어가질 않음
ㅇ.ㅇㅅ,2023-09-15 18:04:49-07:00,2,0,이 앱은 회원탈퇴가 불가능한가요?,"앱 삭제를 하려고 하니, 정보가 저장되어있어서 
탈퇴에 대한 내용은 전혀 없어서요 
회원탈퇴 방법 알려주시면 감사하겠습니다."
배고플땐요기요,2023-09-13 03:28:19-07:00,1,0,앱이 안 열려요,"아이폰xs 사용자이고 ios 버전은 16.6.1입니다. 나만의 닥터 앱을 6.0.0으로 업데이트하고나서 앱이 처음에 뜨는 파란 화면 이후로 넘어가지 않습니다. 대기하면 열릴까 싶어 기다리면 홈화면으로 튕기고요. 앱을 아예 지웠다가 재설치하면 다시 열리긴 하지만 두세 번 정도는 잘 열리다가도 다시 또 먹통이 돼요.
파란 화면 말씀드린 거는 진짜 파란바탕색만 있는 화면 말하는 겁니다. 원래 정상작동할 때는 앱 최신화한다는 문구와 프로그레스바가 뜨는데, 오류날 때는 그냥 아무 문구도 없이 그냥 파란 바탕화면만 떠요."
ilililili01,2023-08-28 08:12:13-07:00,1,0,작동 잘 안되고 혜택도 미미함,"요즘 앱에 만보기는 다 있어서 걸음수 똑같이 올라가는데 이것만 엄청 느리고 안올라감
재부팅 해도 안돼서 포인트 박스 계속 못받음
걷기 모임도 초반에는 20원 이상은 주더니 이제 한자리수 나옴 6원 7원 모아서 수수료는 몇십프로 혜택도 없음 이벤트도 계속 줄였다 없애고 렉도 많고 오래 이용할 사람 없을듯 주변에도 가입시켰는데 다 탈퇴함 추가로 상담원 문의 답변 엄청 느리고 불친절함"
이으우울,2023-08-15 21:16:51-07:00,1,0,짜증남,비대면 진료로 당일 퀵도 가능하다해서 회원가입하고 병원 진료보고나니까 그뒤부터 난리;; 다 거절 큇 거절 당일 거절 주변약국 다 괜찮다는 식으로 홍보해서 비대면 진료보고 결제했으나 병원비는 병원비대로 나가고 약국은 계속 거절함 받아주는 곳없고 직접 방문 수령하고 싶으나 주변약국 전화하니까 비웃던데 ㅋㅋ 이거 어플 자체를 별로 이용안하는데 하는 사람은 있긴한건가? 택배 시켰는데 8/12일날 택배 신청했으나 아직도 출발도 안해 연락도 없어 개 같음 170000원 결제했으나 두번다시 안쓸예정임
존ㄴㄴ나,2023-07-24 03:14:50-07:00,5,0,건의 드리고 싶은게 있습니다,"1.결제 전에 금액이 얼마인지 확인하고 결제하게 해주세요. 
결제하기 누르면 바로 결제가 되어 버리니까 얼마 나왔는지 은행 문자를 봐야만 알 수 있습니다. 결제 전에 확인창이 뜨게 해주세요. 

2.저는 지방에 살아서 퀵이나 빠른 배송 이용이 안되더라구요. 부득이하게 택배를 사용해야하는데 약국에서는 바로 택배를 보내 주지 않습니다. 약국도 바쁘니까 자기들 할일 다 끝내고 약을 몰아서 배송 보내는거 같아요. 이런 처리 과정에 대한 설명이 너무 부족하고 택배 배송시 운송장 번호를 입력하는 공간을 만들어주세요. 그래야 약국측에서 택배를 보내고 운송장을 입력하죠. 그럼 환자들은 택배 배송 현황을 빠르게 확인할 수 있습니다.

3.신고 및 의견 건의 공간을 만들어주세요. 병원에 예약했는데 제가 선택한 의사가 바쁘단 이유로 다른 의사로 바뀌는 경우도 있고, 약 부작용에 대한 설명도 기계처럼 복사 붙여넣기 하듯이 같은 말만 줄줄 읽어주고 부가적인 설명이 너무 부족합니다. 다른 질문을 하려고 해도 서둘러 끊으려고 하거나 애매하게 대답해서 의사가 맞는지 의심이 됩니다. 

4. 병원과 약국에 대한 후기를 따로 남길 수 있게 해주세요"
그레비티이,2023-07-21 18:28:26-07:00,5,0,엄청 편하고 좋아요,귯굿
divjwoskaljgjv,2023-07-15 21:55:31-07:00,1,0,약처방 안됩니다,"진료는 편리하나 중요한 약처방이 안됩니다.
앱 내에서 근처 약국으로 팩스 보냈는데
실제 약국에 방문하면 처방안해줍니다.

비대면 진료 관련 법이 바뀌었다는데
이런 중요한 사실을 안내하지도 않고
어떻게 서비스를 운영하고 계신가요..?"
Yeonhun,2023-07-15 02:24:22-07:00,1,0,불편,"의사랑 비대면으로 하는건 좋은데
처방전 약이 없는경우 , 다시 어떻게 의사와 컨택해야하는지 등 ㅋㅋ 아무것도 정보가 없네요
6천원 넘게 진료비만 날렸어요"
애미콜라,2023-07-14 19:59:15-07:00,5,0,조아여엉어어엉어어ㅓㅇ아앙아,우아아아앙
고만좀해,2023-07-12 17:39:47-07:00,1,1,리뷰 그만삭제하세요 소비자는 알 권리가 있습니다,"이런 기분나쁜 어플은 처음 써보네요. 제일 중요한점을 어플에서도 병원에서도 고지를 안해주시다니 소비자 기만하시는건지
병원에서도 본인은 진료비 받았으니 끝이다 나몰라라하는것도 어이가 없네요
어플 리뷰보니 저같은 사람들이 많더군요 주변약국에서 약 취급자체를 안해서 발급받지 못한사람들이요 그 외에 비대면진료라 약 자체를 안 지어주는 약국도 있고요
이런 허술한 어플땜에 손해입은건 누가 책임져주나요?
적어도 소비자입장을 생각하신다면 공지사항에 필히 적어놓든 하셨어야죠?
처방전에 기간이 있는줄도 몰랐던 사람은 그냥 2만원 눈뜨고 코베이는거네요.
이런식으로 운영하신다면 이용자들이 더 줄어들겁니다 다시는 이용하고싶지 않네요."
토익커ㅋ,2023-07-08 06:48:33-07:00,1,0,혜택 줄이려고 꼼수 업뎃을 너무 하네,만보기 좀 그만 건드려라 쫌
마디어굳디,2023-07-07 18:31:59-07:00,4,0,로그인문제,카카오톡 계정으로 가입했습니다. 로그인 풀려있길래 다시 로그인 하려니 이미 가입된 계정이라는 알림만 뜨고 로그인은 되질 않네요.. 조속한 조치 부탁드립니다.
다ㅏㅇ다닫,2023-07-01 10:08:45-07:00,1,1,약국에서 비대면으로 약처방 불가하다고하네요,법적으로 이제 비대면으로 약 처방 못 하게 바뀌었다고 해요. 의사쪽은 약처방 가능하다고 하고 약국은 법적으로 안 된다고 해서 뭐라 따질 수도 없고 그냥 진료비만 날렸어요 다들 참고하세요
kimjuim88888,2023-06-28 01:05:36-07:00,5,0,너무 간편하고 좋네요,"일하다보면 병원가기가 쉽지않은데
이런 어플이 있어서 처방 조제까지 한번에 연계되니 편하고 좋아요"
박수승,2023-06-28 00:16:21-07:00,5,0,만족헙니다,비대면이긴 하나  대면진료 보는것처럼 상세히 설명 해주셨습니다. 궁금한점 역시 알아듣기 쉽게 이야기 해주시고  대면진료보다 편하고 좋은것 같습니다
tinaay81,2023-06-27 23:07:37-07:00,5,0,다이어트 처방,너무 친절하세요! 설명도 자세히 해주시고
모노머,2023-06-27 18:15:39-07:00,4,0,약성분 뭔지모른다고 전화를 끊어버리는 의사가있네요,약성분명대면서 그거 처방해드려요 하길래 성분은 모르고 내상태가이렇다라고 말하니 그냥 병원가라고 말하고 바로 끊어버리네 그러고 전화통화안된다고 취소해버리니 뭘 할 수가없네요 진료의사목록에서나 뺄 수있게 해주세요
호롤롤로로로로롤,2023-06-26 22:46:42-07:00,4,0,진료 스피드가 어마합니다.,"리뷰보고 다이어트 비대면 진료 신청했는데, 상세하게 설명해주시고 그런줄 알았어요.. 과거에 삭*다 처방받아 본 적 있다고 하니 스피드하게 처방해주신다는 말씀만 하시고 진료가 끝났습니다.. 약국 지정해서 냉장배송으로 선택했는데 모든 서비스면에서 괜찮습니다. 처방 가능한 병원 찾아서 직접 방문하지  않아도 되니 편해서 좋습니다. 특히 이 더운 날씨에요~ 가격은 착하지 않아서 별 한개 뺍니다~"
눈꽃88,2023-06-26 21:35:52-07:00,5,0,간편해요,편리하고 친절하십니다
모텔에서 찾음,2023-06-26 09:46:01-07:00,5,0,친절하고 좋아요.,또 올께요^^
영킹영보스,2023-06-25 23:04:40-07:00,5,0,부담없이 좋습니다,좋습니다
잼이소ㅑ햫,2023-06-25 21:27:47-07:00,5,0,만족해요,너무아파서 병원도 가기힘들때 비대면으로 진료받고 쉬니까 편해요
상추쌈도사,2023-06-25 20:56:26-07:00,1,0,고객센터 전회번호도 없고..,"카드 등록하몀 포인트 주고 바로결제되서 편하다더니 
물어보지도 않고 일시불 결제라니요...
포인트도 쓰고 할랬더니 그냥 뭐 알림도 없이 
의사와 전화통화 끝나자 마자 일시불결제
병원측에서 결제건은 나만의닥터에
문의해야한다고 해서 보니 고객센터 전회번호도 없고 오로지 톡으로 문의해야해서 매우 불편하네요!!!!"
Djsjnwnbd,2023-06-23 21:02:03-07:00,5,0,친절해요,빠르고 잘 상담 해주셔서 감사합니다
산이랑 들이랑,2023-06-22 19:50:45-07:00,4,0,지역 불균형 비대면 진료로~~^^,"강원도에 사는 일인으로 지방은 약 값도 너무 비싸요.
비대면 진료로 지역적 불균형을 해소에 보렴니다."
torytorydo,2023-06-22 17:49:57-07:00,5,0,삭센다처방받았습니다,꼼꼼히 설명해 주셔서 안심이 되었습니다 감사합니다
박하란,2023-06-21 20:44:24-07:00,5,0,짱짱,이렇게 편할거라고는 생각도 못했어요!!
조앙ㅎ,2023-06-21 19:51:50-07:00,5,0,좋아요,"급했는데, 빠르고 정확한 진료로 마음 편하게 받았습니다."
JustinYoon,2023-06-21 19:44:16-07:00,5,0,간편하고 좋습니다,간편하고 좋습니다.
뿜뿜ㅎ,2023-06-20 17:54:22-07:00,5,0,너무너무 좋아요,시간내서 약지으러 갈 필요없이 비대면으로 처방과 최저가 약처방까지 완전 굿굿
김ㅇ야,2023-06-20 17:26:30-07:00,5,0,이시대에 알맞은 앱,편해요
내내내유유유,2023-06-20 02:12:17-07:00,5,0,"친절, 신속, 정확",친절하세요. 약에대해 자세히알려주시고 시간약속도 정확하시네요   감사합니다~!
sublossom,2023-06-20 00:10:08-07:00,4,0,약국 관리 좀 해주세요!,조제 요청해도 안 보는건지 못 보는건지 연결이 몇분간 계속 이어져서 취소할 수밖에 없어요ㅠ 약국은 그냥 방문수령 해야하는 건지 이 부분만 개선되면 더 좋을 거 같아요..!
원기충전,2023-06-19 18:24:29-07:00,5,0,추천해요,"너무 편리합니다.
다만 약국 선택시 매번 주소, 결제 관련 재입력해야하는게 약간 귀찮아요."
낭월리,2023-06-18 23:47:31-07:00,5,0,개편함,개퍈함
호잇이랑,2023-06-18 22:06:32-07:00,5,0,엄청 편해요,비대면으로 집앞까지 배송해주니까 좋아요
예압827491,2023-06-18 20:23:33-07:00,1,1,제휴약국몇개 안되서,진료비만 내고 약조제 다 거부 당했네요.
윈터로즈,2023-06-18 19:11:53-07:00,1,0,로그인이 안 돼요,"가입도 몇 번만에 했는데 됐는지 안 됐는지 모르겠더니
이미 가입했다고 하면서 로그인이 안 됨ㅋㅋ... 
탈퇴는 또 어떻게 한담?"
오히스라,2023-06-18 06:14:44-07:00,5,0,탈모 약 처방,처음 해보는데 편리하고 만족스럽네요
걍뭐..,2023-06-18 02:56:36-07:00,5,0,친절하고 좋으세요.,일요일인데 편하게 진료했네요. 친절하고 좋으십니다
이즈12,2023-06-18 00:03:31-07:00,5,0,너무좋아요,굿굿
휘쏘,2023-06-17 20:15:58-07:00,4,0,친절하세요,"바쁘실텐데 차근차근 대화해 주셨습니다
감사합니다"
수라왕슈라토,2023-06-16 18:45:13-07:00,5,0,급한 상황 속 굿 닥터!,일단 친절하고 간략.명확한 상담과 보편적인 처방비와 약제비로 치료를 시작할 수 있게 됐습니다.
대실망2,2023-06-15 03:19:44-07:00,1,1,관리도 전혀 안 됨,"정해진 의사가 아닌 다른 사람이 정해진 시간도 안 지키고 막 전화하고 사진까지 올려 놓은 복용약이 아닌 듣보잡 이상한 카피약을 처방해 주었음. 
겁나는 사이트임다."
피팤,2023-06-15 03:08:05-07:00,5,0,싸게 잘 구매함,직접가는것보다 훨씬싸게 구입했습니다!
woovean,2023-06-14 17:22:09-07:00,5,0,다이어트 주사 처방,꼼꼼하게 상담하고 처방해주셨어요👍
금귤2,2023-06-13 19:08:04-07:00,1,0,완전 불편함,"카카오톡, 앱내 고객센터 문의 넣어도 답도 없고 
다른 비대면 앱 고객센터처럼 운영되면 바라는게
없겠음 그외 다른건 좋아요"
ggaahhjj,2023-06-13 18:38:58-07:00,5,0,편합니다,좋아요
Dajookim,2023-06-13 17:20:29-07:00,5,0,잘쓰고 있어요,급할때 사용하기 넘 좋아요 병원까지 못갈정도로 아플때요
리경입니다,2023-06-11 23:07:52-07:00,5,0,깰끔,왓다리갓다리안하고 편해요
‘ㅜ,2023-06-11 22:16:03-07:00,5,0,좋아요,"병원갈시간이없는데
비대면으로 집까지 배달오니 너무 편해여ㅠㅠ"
광신달구지,2023-06-11 21:45:12-07:00,5,0,친절,"진료에대해서 설명도잘해주시고 친절히
잘응대해주셔습니다"
세에에에커커커,2023-06-11 20:01:45-07:00,5,0,굿,코로나 시대에 개혁명 개죠음
간절히기도해요,2023-06-11 18:15:01-07:00,5,0,최고의 어플,"우울증과 대인기피증이 있어 병원 한번 가기 힘든 저에게 빛과도 같은 어플입니다
사라진다는 것이 너무나도 아쉽고 속상하네요"
신라면세점굿,2023-06-11 16:48:01-07:00,5,0,비대면진료,원하는 시간에 원하는 선생님과 약국을 비교해서 처방가능하니 너무 좋습니다
진진띵,2023-06-10 23:48:12-07:00,5,0,어플리뷰,간편하고 믿을 수 있어서 너무 좋아요~~
Crave07,2023-06-08 20:03:03-07:00,5,0,너무좋아요,안없어졌으면 ㅠㅠ
dmsgk415263,2023-06-08 19:29:21-07:00,5,1,아쉬운 점!!,약국을 선택할 때 약국을 검색할 수 있게 해주셨으면 좋겠어요 . 계속 스크롤 밑으로 내리면서 하니까 착한 가격 찾기가 힘들더라고요. 그리고 최저가 순으로 보여주시면 더 좋을 것 같아요. 약국을 선택하고 가격보고 다시 취소하고 반복하니까 너무 힘들더라고요ㅠㅠ 그렇지만 비대면이라 시간의 제약이 없다는것 빠른 진료가 가능하다는 점 가격을 미리 안내받을 수 있다는 점이 매우 좋네요. 앞으로도 자주 이용할 것 같아요! 감사합니다
kkiri0417,2023-06-08 17:45:37-07:00,5,0,친절하시고 신속하게 상담해주셨어요,약효과는 복용전이라 아직 모르겠지만 상담은 만족스럽습니다~
1(/)3,2023-06-08 06:52:57-07:00,5,0,진짜 이런 앱 너무 좋습니다,주변 병원도 약국도 모두 닫은 저녁 시간에 진료와 조제가 가능한 곳들을 바로 연결해서 집에서 급하게 약 먹을 수 있어서 기뻤습니다 감사합니다
야닉시너,2023-06-08 00:59:34-07:00,5,0,빠른 진료,정말 빠른 진료와 친절한 상담 무엇보다 편리함이 너무 좋습니다 감사합니다
이엥응,2023-06-07 22:59:28-07:00,5,0,감사해요❤️,친절히 상담 해주시고 약도 최대한 지체하지 않고 처방 해주셔서 불안한 마음이 싹 가셨네요 너무 감사드려요!
Hadden:),2023-06-07 21:26:25-07:00,5,0,시간없을땐 최고,잘 사용하고 있어요^^
님반달,2023-06-07 19:27:46-07:00,5,0,최고에요,덕분에 빠르게 진료 보고 필요한 약들을 살 수 있는 기회를 앱을 통해서 편안함을 느끼고 있어요
킴경,2023-06-06 21:51:49-07:00,5,0,굿굿,귯굿귯
Nikestamp,2023-06-04 23:27:50-07:00,5,0,공황장애 와서 병원 예약 못했는데,"이 어플 추천 합니다
여러분 급한 약재조 필수예요 
공황장애 한달 기다리라고 했는데 
약부터 먹는게 우선인거 같아여"
sungmi's,2023-06-04 22:30:32-07:00,5,0,너무 편리한 세상이 왔네요!,"의사쌤이 예약시간맞춰 전화주시고, 약도 약국선택해서 택배로 배송됩니다!"
아 진짜 뭐로하냐,2023-06-04 20:44:40-07:00,1,1,진료 안해줌 돈 아까움,"한번 진료에 2만원...차라리 병원가서 진료하는게 더 좋을것 같아요. 비대면이라 진료를 못하는건 맞지만 그래도 ”어디가 안좋냐“, “지금은 어디가 어떻게 아프냐” 이런건 물어봐야하는거 아닌가요? 2만원 그냥 날린 기분이여서 기분이 좋진 않네요. 다신 사용 안합니다."
팍지성,2023-06-04 18:49:45-07:00,5,0,편리하고 시간없는 직장인에게 좋아요,궁금한것들 주의사항 잘 알려쥬시네요^^
최고에오 굿,2023-06-04 18:01:22-07:00,5,0,추천해요,"병원업무시간이랑 근무시간이
겹치는 사람들에게는 아주 편리한 어플인거같아여!"
ddoob,2023-06-04 17:57:04-07:00,5,0,앱 잘 만들었네요,사용성 좋아요
씽쏭 붕어,2023-06-03 04:20:43-07:00,5,0,너ㅜ조아용,외ㅏㄴ전조아용 ㅎㅎ❤️
관켈메,2023-06-02 22:32:04-07:00,5,0,굿굿,웅
에쬬엘,2023-06-02 20:26:10-07:00,5,0,왜 이제야 알았을까...,피부과 번거롭게 다니면서 오래 대기하고 진료비 약값 몇 배나 비싸게 낸 게 억울하네요ㅠㅠ 진작 알았으면 좋았을걸...
흐어랍,2023-06-02 01:30:27-07:00,5,0,왜 진작 안나오나 싶었던 서비스,"서비스 아주 훌륭합니다 ㅠㅠ
지금 신입 모집중이던데 장고 전문으로 팠었으면 바로 지원했을텐데 너무 아쉽습니다 ㅠㅠ"
ggaegull,2023-06-02 00:21:29-07:00,5,0,편리하고 좋아요~,요즘같이 코로나 시기에 병원 방문하기가 꺼려지는데 비대면 어플로 처방받고 약까지 배송받으니 너무 좋네요~
학도야,2023-06-01 23:56:13-07:00,4,0,비대면 진료에서 처방까지,"처음 경험삼아 해봤는데,, 민감한 진료사항이 아니라서 ,편리하고 비용도 절감돼서 만족스럽습니다.."
오동코,2023-06-01 23:24:07-07:00,5,0,좋아요,항상 바쁜와중에 잘이용하고있습니다
와우 좋아요,2023-06-01 22:55:24-07:00,5,0,기대이상👍,"무척 친절하시네요 
전화라고 대충봐주시는 줄 알았는데 친절히 잘 성명해 주셔서 진료받는데 부담이 없어 좋았습니다
감사합니다"
연맹탄,2023-06-01 22:31:00-07:00,5,0,집순이 최고의 어플,집에서 안나가고 약 받을 수 있는게 진짜 최고입미다
쌍둥맘홍틀러,2023-06-01 18:52:37-07:00,1,0,친절하세요,친절하시네요
CCCHESSSS,2023-06-01 17:29:02-07:00,1,0,진료비 안내 없이 자동결제,진료비 따로 적혀있는 것도 없이 연결해주더니 2만원이 진료비로 나감...
행성야기,2023-05-31 21:18:56-07:00,5,0,감사,저렴한 진료와 약처방 감사합니다
히히히쩜,2023-05-31 18:59:34-07:00,5,0,편해요,"비대면진료
너무편해요!"
ssooteon,2023-05-31 18:57:32-07:00,5,0,요즘 같은 시대에 최고!!,바쁜 현대인에게 비대면 진료를 어플로 정확하고 빠르게 최고최규
즈밍구,2023-05-30 23:50:26-07:00,5,0,좋아요,항상 편하고 이용 중이에요!!
77ㅑ77F,2023-05-30 22:10:20-07:00,5,0,여태 써본 비대면 진료 앱중 가장 편해요,의사선생님 후기도 많이 쌓여있고 진료 경험도 너무 좋았습니다. 손하나 까딱 못하겠는데 처방약으로 확 낫고 싶었는데 넘 도움 되네요ㅠ
태양💥,2023-05-30 19:15:26-07:00,5,0,친절하고 편안하게,"친절하고
편안하게
대해주셔서
감사합니다"
유나리ㅣ,2023-05-30 01:39:16-07:00,5,0,좋고 편해요,병원갈 시간이 없을때 너무 편하게 잘 이용하고 있습니아
안됨1244332,2023-05-30 00:24:35-07:00,5,0,자라나라 머리머리,정수리를 살리자
하나좋아,2023-05-29 23:38:56-07:00,5,0,나만의 닥터는 최고입니다,나만의 닥터만한 어플 못봤음. 진짜 최고임. 나만의 닥터가 있어줘서 진짜 너무 고마움.
Sofun9,2023-05-29 21:48:09-07:00,5,0,편리하고 빠른 진료 처방 좋네요,좋습니다.
왜들그리다운돼있엉,2023-05-29 08:34:42-07:00,5,1,인공눈물처방,인공눈물 처방받고 연계약국으로 배송신청했는데 1주일이 지나도 배송 안 와서 문의 넣었더니 바로 해결해주셨습니다. 퀵배송으로 다음날 바로옴ㅎㅎ. 요즘 비대면 어플 많은데 여기는 맘편히 사용해도 될듯..ㅎㅎ☺️ 사실 서비스는 문제가 생겼을때 가장 드러나는 법이자나요
쩡잉야,2023-05-29 05:57:33-07:00,5,0,급하게 진료 필요할 때 좋아요,늦은 밤 공휴일 진료가 필요할 때 접수도 빠르고 좋아요
삐뺘뱌,2023-05-29 04:16:27-07:00,5,0,너무좋아요,아플때너무좋습니다
ism2703,2023-05-29 00:41:54-07:00,5,0,좋네용,처음 해봤는데 편하네요~ 앞으로도 이용할것 같아용
쩰리뽀공듀,2023-05-28 23:54:31-07:00,5,0,나만의 닥터 최고♥️,언제 어디서든 비대면으로 편리하게 진료 볼수있고 의사선생님도 직접 정해서 볼수있으니 너무 편하고 좋아요 결제방식도 간편해서 전화한통후 증상 말하고 결제후 간편하게 집에서 받아볼수있으니 너무 좋네요
토토두부맘,2023-05-28 21:48:01-07:00,5,0,최고에요,진짜 너무 좋아요 약이 급해서 혹시나 될까해서 이용해봤는데 배송도 빠르고 너무 좋네요 ㅠㅠ
엠디엔피,2023-05-28 08:35:31-07:00,5,0,비대면진료로 환자에게 편리함을 제공하는 앱,나만의닥터 제발 없어지지말아주세요 ㅠ
보링^^,2023-05-28 03:35:18-07:00,1,1,비대면 진료,"비대면 진료 급할땐 좋지만 약 처방할 때 기본적인 주의사항과 부작용 안내는 필수인데 이 기본적인 것조차 안하시는 걸 보고 충격먹었네요,, 아무리 비대면 진료여도 유선상으로 설명은 가능한 부분인데 의사와 업체 모두 경각심을 가지셔야 할 것 같습니다. 24**의원 조심하세요."
Yunmi84,2023-05-27 21:44:46-07:00,5,0,넘좋아요,"코로나로 첨 사용해 봤는데 주말에
이렇게 편리하게 사용하다니 넘 좋네요"
하지여,2023-05-27 19:49:07-07:00,5,0,친절하게 약제 해주셔서 감사합니다,친절하게 약제 해주셔서 감사합니다
레어난,2023-05-26 22:06:58-07:00,5,0,겁내 만족합니다,너무 편리해요 직장인 필수템
Wjswls89,2023-05-26 18:59:16-07:00,5,0,좋아요,빠르고 좋아요
하신성,2023-05-25 23:44:51-07:00,5,0,제발,효과있길
우우아우아우아우ㅏ,2023-05-25 21:45:11-07:00,5,0,좋습니더,직장때문에 병원가기가 어려운데 아주 편리합니다
리리릴라오,2023-05-25 20:37:42-07:00,5,0,비대면진료짱👍🏻,비대면으로 진료보고 약까지 받으면 넘나 편하고 😄
ㅣㅐㅛ아,2023-05-24 23:42:49-07:00,4,0,나이스합니다,진짜제일편함…
tkejr147,2023-05-24 19:47:32-07:00,5,0,편하고 좋아요,병원 가기 힘들었는데 편하고 좋아요
좇간지,2023-05-24 18:26:51-07:00,5,0,비대면 진료 맘에 들어요,빠르고 정말 좋네요
Gkgkka,2023-05-24 08:46:55-07:00,5,0,굿,ㄱㄱ
ㅑ어자라낱,2023-05-24 07:21:55-07:00,5,0,최고에용,바빠서 병원못갈때 편리해요
용서mama,2023-05-23 18:00:55-07:00,5,0,비대면진료,빠른진료에민족합니다
codusasdf,2023-05-23 08:26:06-07:00,5,0,늦은시간에도 감사드립니다,도저히 병원갈 시간이 없어 처음 시도해봤는데 빠르게 처방해주셔서 감사합니다 ㅎㅎ 조곤조곤 친절하십니다
스티브 잡스슨,2023-05-22 23:28:08-07:00,5,0,이게 되네요 ㅜㅜㅜ,전화로 진료받고 약 받는게 된다니 ㅜㅜ 코로나 때문에 엄청 고생했는데 덕분에 잘 지나갔습니다 ㅜㅜㅜㅜ 글고 고객상담해주시는 분이 진짜 친절했어요 ㅜㅜ 늦은 저녁인데도 친절하게 이야기해주시고 차근차근 설명해주셔서 약까지 무사히 받았네요 ㅜㅜ 이거 혹시 앱 사장님이 보신다면 상담하시는분들 월급좀 올려주세여 ㅜㅜ
짬짱111,2023-05-22 22:32:14-07:00,5,0,굿,너무 편하고 넘 좋음
직원이다,2023-05-22 19:00:04-07:00,5,0,비대면 진료,간편하고 시간 아낄 수 있어서 좋아요
jkllo2030,2023-05-22 06:38:32-07:00,5,0,좋아요,회사를 다니면 평일에 대면진료 받기가 어려운데 편하고 좋아요
바크콜그란데,2023-05-22 02:48:23-07:00,5,0,비대면진료,비대면진료 처음 받아봤는데 시간이 많이 없는 직장인한테 너무 편리하고 좋습니다! 앞으로도 자주 이용할 것 같습니다
꿀냥냥,2023-05-21 21:15:09-07:00,5,0,너무조아요,편리하고 가격도 저렴해서 너무 좋습니다
응급모면,2023-05-19 07:39:46-07:00,5,1,와….최고예요,어쩌다…금요일 밤에 실수를하게 되어서 급하게 사후 피임약을 먹어야 했는데 인터넷에 쳐보니까 이 어플이 가능하다고 하더라구요… 덕분에 응급처방받고 위기를…… ㅜㅠㅠㅠ 다신 이런 일이 있으면 안되겠지만 정말 이 어플 덕에 살았어요 ㅠㅠㅠ 감사합니다
넌나의별이얌,2023-05-18 22:07:17-07:00,5,0,편리해서 너무 좋아요,비대면으로 하는거라 사실 반신반의 하면서 어플을 깔았는데 생각했던 것 보다 더 편리하고 빠르게 진행되서 좋았어요
john3kim,2023-05-18 21:36:29-07:00,5,0,나만의 닥터 최고,우선 비대면도 비대면이지만 의사선생님이 엄청 친절하셨어요. 직접 대면해서 받는 서비스만큼 도움되는 설명 해주시고 약국도 고를 수 있다는 점도 좋아요.
